{
  "schema_version": 2,
  "id": "ddnet",
  "name": "DDNet Dedicated Server",
  "description": "Install the DDNet dedicated server through SteamCMD and launch its native Linux server binary directly.",
  "version": "1.0.0",
  "category": "steamcmd",
  "minimum_gamenode_version": "0.2.0",
  "known_limitations": ["The Pelican Egg's generated configuration is not imported; configure advanced DDNet settings in the server files after provisioning.", "Linux console interrupt handling is not exposed by the Native runtime, so stop uses the bounded terminate fallback."],
  "icon": "steamcmd",
  "source_type": "official",
  "source_identifier": "pelican-eggs/ddnet",
  "source_format_version": "2",
  "tags": ["ddnet", "steam", "steamcmd", "platformer"],
  "source_metadata": {"author": "GameNode, normalized from Pelican Eggs", "tags": ["ddnet", "steam", "steamcmd", "platformer"]},
  "installer": {"type": "steamcmd", "steamcmd": {"app_id": 412220, "validate": true, "login_mode": "anonymous", "platform": "native", "install_target": "server_root"}},
  "platform_launches": {"linux": {"executable": "ddnet/DDNet-Server", "arguments": [], "working_root": "server_root", "stop_method": "terminate", "stop_timeout_seconds": 30}},
  "variables": [],
  "ports": [{"name": "Game", "protocol": "udp", "port": 8303, "required": true, "purpose": "Default DDNet game traffic"}],
  "expected_files": [{"path": "ddnet/DDNet-Server", "type": "file", "required": true, "executable": true, "platform": "linux"}],
  "requirements": [{"type": "os", "level": "hard", "value": "linux", "description": "The reviewed Pelican launch targets the native Linux server."}, {"type": "steamcmd", "level": "hard", "value": "anonymous", "description": "Managed anonymous SteamCMD installation is required."}],
  "help": {"summary": "GameNode installs Steam App 412220 anonymously and launches DDNet-Server without a shell."},
  "compatibility": {"status": "partially_compatible", "findings": [{"severity": "warning", "component": "configuration", "code": "PELICAN_CONFIG_NOT_IMPORTED", "summary": "Pelican's generated DDNet configuration is not part of the safe SteamCMD template contract."}]},
  "read_only": true,
  "platforms": ["linux"],
  "prerequisites": ["64-bit Linux host", "Network access to Steam content servers"]
}
