{
  "schema_version": 2,
  "id": "puck",
  "name": "Puck Dedicated Server",
  "description": "Install the Puck dedicated server through SteamCMD and launch its native Linux server binary directly.",
  "version": "1.0.0",
  "category": "steamcmd",
  "minimum_gamenode_version": "0.2.0",
  "known_limitations": ["The upstream Egg does not pass its server-name, password, player-limit, or ping-port variables on the process command line; GameNode does not expose ineffective settings.", "Stop uses the bounded terminate fallback."],
  "icon": "steamcmd",
  "source_type": "official",
  "source_identifier": "pelican-eggs/puck",
  "source_format_version": "2",
  "tags": ["puck", "steam", "steamcmd", "sports", "hockey"],
  "source_metadata": {"author": "GameNode, normalized from Pelican Eggs", "tags": ["puck", "steam", "steamcmd", "sports", "hockey"]},
  "installer": {"type": "steamcmd", "steamcmd": {"app_id": 3481440, "validate": true, "login_mode": "anonymous", "platform": "native", "install_target": "server_root"}},
  "platform_launches": {"linux": {"executable": "Puck.x86_64", "arguments": [], "working_root": "server_root", "stop_method": "terminate", "stop_timeout_seconds": 30}},
  "variables": [],
  "ports": [{"name": "Game", "protocol": "udp", "port": 7777, "required": true, "purpose": "Default Puck server traffic"}],
  "expected_files": [{"path": "Puck.x86_64", "type": "file", "required": true, "executable": true, "platform": "linux"}],
  "requirements": [{"type": "os", "level": "hard", "value": "linux", "description": "The reviewed Pelican launch targets the native Linux server."}, {"type": "steamcmd", "level": "hard", "value": "anonymous", "description": "Managed anonymous SteamCMD installation is required."}],
  "help": {"summary": "GameNode installs Steam App 3481440 anonymously and launches Puck.x86_64 without a shell."},
  "compatibility": {"status": "partially_compatible", "findings": [{"severity": "warning", "component": "configuration", "code": "PUCK_EGG_VARIABLES_UNUSED", "summary": "The reviewed Egg declares settings that are not consumed by its startup command, so they are intentionally not copied."}]},
  "read_only": true,
  "platforms": ["linux"],
  "prerequisites": ["64-bit Linux host", "Network access to Steam content servers"]
}
