{
  "schema_version": 2,
  "id": "nova-life-amboise",
  "name": "Nova-Life: Amboise Dedicated Server",
  "description": "Install the Nova-Life: Amboise dedicated server through SteamCMD and launch its native Linux server directly.",
  "version": "1.0.0",
  "category": "steamcmd",
  "minimum_gamenode_version": "0.2.0",
  "known_limitations": ["The upstream Egg does not document a graceful stop command, so stop uses the bounded terminate fallback.", "Advanced settings remain file-managed."],
  "icon": "steamcmd",
  "source_type": "official",
  "source_identifier": "pelican-eggs/novalife_amboise",
  "source_format_version": "2",
  "tags": ["nova-life", "amboise", "steam", "steamcmd", "roleplay"],
  "source_metadata": {"author": "GameNode, normalized from Pelican Eggs", "tags": ["nova-life", "amboise", "steam", "steamcmd", "roleplay"]},
  "installer": {"type": "steamcmd", "steamcmd": {"app_id": 1665030, "validate": true, "login_mode": "anonymous", "platform": "native", "install_target": "server_root"}},
  "platform_launches": {"linux": {"executable": "nova-life.x86_64", "arguments": ["-batchmode", "-nographics", "-startServer", "{{SERVER_NAME}}"], "working_root": "server_root", "stop_method": "terminate", "stop_timeout_seconds": 30}},
  "variables": [{"name": "Server name", "description": "Name passed to Nova-Life when starting the dedicated server.", "key": "SERVER_NAME", "default_value": "GameNode Server", "user_viewable": true, "user_editable": true, "type": "string", "sensitive": false, "required": true, "nullable": false, "validation": {"min_length": 1, "max_length": 80}, "group": "Server"}],
  "ports": [{"name": "Game", "protocol": "udp", "port": 7777, "required": true, "purpose": "Default Nova-Life game traffic"}],
  "expected_files": [{"path": "nova-life.x86_64", "type": "file", "required": true, "executable": true, "platform": "linux"}],
  "requirements": [{"type": "os", "level": "hard", "value": "linux", "description": "The reviewed Pelican launch targets the native Linux server."}, {"type": "steamcmd", "level": "hard", "value": "anonymous", "description": "Managed anonymous SteamCMD installation is required."}],
  "help": {"summary": "GameNode installs Steam App 1665030 anonymously and launches nova-life.x86_64 directly."},
  "compatibility": {"status": "compatible", "findings": [{"severity": "info", "component": "configuration", "code": "NOVA_LIFE_FILE_CONFIGURATION", "summary": "Only the process-level server name is exposed; advanced configuration remains file-managed."}]},
  "read_only": true,
  "platforms": ["linux"],
  "prerequisites": ["64-bit Linux host", "Network access to Steam content servers"]
}
