{
  "schema_version": 2,
  "id": "enshrouded",
  "name": "Enshrouded Dedicated Server",
  "description": "Install the Enshrouded dedicated server through SteamCMD and launch enshrouded_server.exe directly without a shell.",
  "version": "1.0.0",
  "category": "steamcmd",
  "minimum_gamenode_version": "0.2.0",
  "known_limitations":["Enshrouded stores its settings in a game-owned JSON document. GameNode currently exposes the file as metadata only and does not rewrite it with an unsafe generic JSON adapter.","The current server configuration uses queryPort 15637; older documentation may mention a separate gamePort, so GameNode does not register an unverified second port.","Automatic updates and generated save/log directory management are outside this template."],
  "icon":"steamcmd",
  "source_type":"official",
  "source_identifier":"enshrouded",
  "source_format_version":"2",
  "tags":["enshrouded","steam","steamcmd","survival","crafting"],
  "source_metadata":{"author":"GameNode","tags":["enshrouded","steam","steamcmd","survival","crafting"]},
  "installer":{"type":"steamcmd","steamcmd":{"app_id":2278520,"validate":true,"login_mode":"anonymous","platform":"native","install_target":"server_root"}},
  "platform_launches":{"windows":{"executable":"enshrouded_server.exe","arguments":[],"working_root":"server_root","stop_method":"terminate","stop_timeout_seconds":60}},
  "variables":[
    {"name":"Server name","description":"Name shown in the Enshrouded server list.","key":"SERVER_NAME","default_value":"GameNode Enshrouded","user_viewable":true,"user_editable":true,"type":"string","sensitive":false,"required":false,"nullable":false,"validation":{"min_length":1,"max_length":64},"group":"Server"},
    {"name":"Query port","description":"Current Enshrouded UDP query/game port.","key":"QUERY_PORT","default_value":"15637","user_viewable":true,"user_editable":true,"type":"integer","sensitive":false,"required":false,"nullable":false,"validation":{"min":1024,"max":65535},"group":"Network"},
    {"name":"Player slots","description":"Maximum player slots; Enshrouded supports 1 to 16.","key":"PLAYER_SLOTS","default_value":"16","user_viewable":true,"user_editable":true,"type":"integer","sensitive":false,"required":false,"nullable":false,"validation":{"min":1,"max":16},"group":"Server"},
    {"name":"Voice chat mode","description":"Proximity or global voice chat.","key":"VOICE_CHAT_MODE","default_value":"Proximity","user_viewable":true,"user_editable":true,"type":"enum","sensitive":false,"required":false,"nullable":false,"validation":{"allowed":["Proximity","Global"]},"group":"Communication"},
    {"name":"Voice chat enabled","description":"Enable voice chat.","key":"VOICE_CHAT_ENABLED","default_value":"false","user_viewable":true,"user_editable":true,"type":"boolean","sensitive":false,"required":false,"nullable":false,"validation":{},"group":"Communication"},
    {"name":"Text chat enabled","description":"Enable text chat.","key":"TEXT_CHAT_ENABLED","default_value":"false","user_viewable":true,"user_editable":true,"type":"boolean","sensitive":false,"required":false,"nullable":false,"validation":{},"group":"Communication"},
    {"name":"Gameplay preset","description":"Official Enshrouded difficulty preset.","key":"GAMEPLAY_PRESET","default_value":"Default","user_viewable":true,"user_editable":true,"type":"enum","sensitive":false,"required":false,"nullable":false,"validation":{"allowed":["Default","Relaxed","Hard","Survival","Custom"]},"group":"Gameplay"}
  ],
  "ports":[{"name":"Query/Game","protocol":"udp","port":15637,"required":true,"purpose":"Current Enshrouded server query/game port"}],
  "expected_files":[{"path":"enshrouded_server.exe","type":"file","required":true,"executable":true}],
  "config_files":[{"path":"enshrouded_server.json","format":"json","description":"Generated server name, save/log directories, bind address, query port, slots, voice/text chat, and gameplay preset."}],
  "configuration":{"adapters":[{"id":"enshrouded-server-settings","schema_version":1,"file":"enshrouded-server-settings.adapter.json"}]},
  "requirements":[{"type":"os","level":"hard","value":"windows","description":"The current Steam dedicated-server depot is Windows-only."},{"type":"steamcmd","level":"hard","value":"anonymous","description":"Managed anonymous SteamCMD installation is required."},{"type":"architecture","level":"hard","value":"amd64","description":"The dedicated server is a 64-bit Windows executable."}],
  "help":{"summary":"GameNode installs SteamCMD App ID 2278520 and launches enshrouded_server.exe directly.","notes":["Start once to generate enshrouded_server.json, then configure the game-owned JSON while stopped.","The official default queryPort is UDP 15637 and slotCount is limited to 16."]},
  "compatibility":{"status":"partially_compatible","findings":[{"severity":"warning","component":"configuration","code":"ENSHROUDED_JSON_ADAPTER_UNAVAILABLE","summary":"The current adapter set supports XML, constrained INI, Unreal tuple data, and managed launch bindings, but not safe game-owned JSON editing."}]},
  "read_only":true,
  "platforms":["windows"],
  "prerequisites":["Network access to Steam content servers during installation","An amd64 Windows host","Sufficient storage for the server build and savegame"]
}
