{
  "schema_version": 2,
  "id": "runescape-dragonwilds",
  "name": "RuneScape: Dragonwilds Dedicated Server",
  "description": "Install the RuneScape: Dragonwilds dedicated server through SteamCMD, launch its native server binary directly, and manage its owner, server, world, and password settings.",
  "version": "1.1.0",
  "category": "steamcmd",
  "minimum_gamenode_version": "0.2.0",
  "known_limitations": [
    "GameNode edits OwnerId, ServerName, DefaultWorldName, AdminPassword, and WorldPassword in DedicatedServer.ini. Other settings, and the ServerGuid and admin history the server writes itself, are left untouched.",
    "The server creates DedicatedServer.ini on its first run and exits without a valid OwnerId. Start it once, fill in the values under Configuration while it is stopped, then start it again.",
    "The server overwrites DedicatedServer.ini while running. Edit it only while stopped.",
    "Servers provisioned from template version 1.0.0 have no configuration adapter; GameNode never migrates an existing server.",
    "Automatic updates, backups, and world migration are outside this template."
  ],
  "icon": "steamcmd",
  "source_type": "official",
  "source_identifier": "runescape-dragonwilds",
  "source_format_version": "2",
  "tags": [
    "runescape",
    "dragonwilds",
    "steam",
    "steamcmd",
    "survival",
    "rpg"
  ],
  "source_metadata": {
    "author": "GameNode",
    "tags": [
      "runescape",
      "dragonwilds",
      "steam",
      "steamcmd",
      "survival",
      "rpg"
    ]
  },
  "installer": {
    "type": "steamcmd",
    "steamcmd": {
      "app_id": 4019830,
      "validate": true,
      "login_mode": "anonymous",
      "platform": "native",
      "install_target": "server_root"
    }
  },
  "platform_launches": {
    "windows": {
      "executable": "RSDragonwilds.exe",
      "arguments": [
        "-log",
        "-NewConsole"
      ],
      "working_root": "server_root",
      "stop_method": "terminate",
      "stop_timeout_seconds": 60
    },
    "linux": {
      "executable": "RSDragonwilds/Binaries/Linux/RSDragonwildsServer-Linux-Shipping",
      "arguments": [
        "-log"
      ],
      "working_root": "server_root",
      "stop_method": "terminate",
      "stop_timeout_seconds": 60
    }
  },
  "variables": [],
  "ports": [
    {
      "name": "Game",
      "protocol": "udp",
      "port": 7777,
      "required": true,
      "purpose": "Dragonwilds dedicated-server port; additional instances use subsequent ports"
    }
  ],
  "expected_files": [
    {
      "path": "RSDragonwilds.exe",
      "type": "file",
      "required": true,
      "executable": true,
      "platform": "windows"
    },
    {
      "path": "RSDragonwilds/Binaries/Linux/RSDragonwildsServer-Linux-Shipping",
      "type": "file",
      "required": true,
      "executable": true,
      "platform": "linux"
    }
  ],
  "config_files": [
    {
      "path": "RSDragonwilds/Saved/Config/WindowsServer/DedicatedServer.ini",
      "format": "ini",
      "description": "Windows Unreal server settings including OwnerId, ServerName, DefaultWorldName, AdminPassword, and WorldPassword."
    },
    {
      "path": "RSDragonwilds/Saved/Config/LinuxServer/DedicatedServer.ini",
      "format": "ini",
      "description": "Linux Unreal server settings including OwnerId, ServerName, DefaultWorldName, AdminPassword, and WorldPassword."
    }
  ],
  "requirements": [
    {
      "type": "steamcmd",
      "level": "hard",
      "value": "anonymous",
      "description": "Managed anonymous SteamCMD installation is required by the official setup guide."
    },
    {
      "type": "architecture",
      "level": "hard",
      "value": "amd64",
      "description": "The reviewed Windows and Linux builds target x86-64 hosts."
    },
    {
      "type": "disk",
      "level": "informational",
      "description": "Ensure sufficient storage for the server build and world saves."
    }
  ],
  "help": {
    "summary": "GameNode installs SteamCMD App ID 4019830 and launches the native Windows or Linux Dragonwilds server binary.",
    "notes": [
      "Start the server once so it creates DedicatedServer.ini, stop it, then set the Owner ID, server name, world name, and admin password in GameNode's Configuration tab and start it again.",
      "Owner ID is your in-game Player ID, shown at the bottom of the Settings menu.",
      "Forward UDP 7777 for the first instance; later instances use subsequent ports.",
      "The current Steam tool supports anonymous installation according to the official Jagex guide, although some deployments may require a licensed Steam login."
    ]
  },
  "compatibility": {
    "status": "partially_compatible",
    "findings": [
      {
        "severity": "warning",
        "component": "identity",
        "code": "DRAGONWILDS_OWNER_ID_REQUIRED",
        "summary": "The server will not start as usable without the owner's in-game Player ID in OwnerId."
      }
    ]
  },
  "read_only": true,
  "platforms": [
    "windows",
    "linux"
  ],
  "prerequisites": [
    "Network access to Steam content servers during installation",
    "An amd64 Windows or Linux host",
    "A Dragonwilds Player ID for OwnerId"
  ],
  "configuration": {
    "adapters": [
      {
        "id": "dragonwilds-dedicated-server-windows",
        "schema_version": 1,
        "file": "dragonwilds-windows.adapter.json"
      },
      {
        "id": "dragonwilds-dedicated-server-linux",
        "schema_version": 1,
        "file": "dragonwilds-linux.adapter.json"
      }
    ]
  }
}
